{
  "schema_version": 1,
  "request_id": "logical-action-001",
  "connection_id": "77777777-7777-4777-8777-777777777777",
  "resource_id": "88888888-8888-4888-8888-888888888888",
  "request": {
    "method": "POST",
    "path": "/repos/acme/example/pulls",
    "query": {},
    "headers": {
      "accept": "application/vnd.github+json"
    },
    "body": {
      "title": "Release candidate",
      "head": "release-candidate",
      "base": "main"
    }
  }
}
